728;S2113;Cisatracurium Besylate;O08;2;O;8;USP, INN, BAN, JAN;h4;L1300-07;124348;96946-42-8;Adrenergic Receptor;249;200,2444752;47;37,79714993;http://www.selleckchem.com/products/cisatracurium-besylate-nimbex.html;Cisatracurium Besylate is a nondepolarizing neuromuscular blocking agent, antagonizing the action of acetylcholine by inhibiting neuromuscular transmission.;Neuronal Signaling;C65H82N2O18S2;Besylate;N/A;[O-]S(=O)(=O)C1=CC=CC=C1.[O-]S(=O)(=O)C1=CC=CC=C1.COC1=CC=C(C[C@@H]2C3=CC(OC)=C(OC)C=C3CC[N@+]2(C)CCC(=O)OCCCCCOC(=O)CC[N@@+]2(C)CCC3=CC(OC)=C(OC)C=C3[C@H]2CC2=CC=C(OC)C(OC)=C2)C=C1OC |r,c:6,8,16,18,36,71,85,88,t:4,14,22,24,28,32,63,67,77,79|;3,646;12;0;28;7;h;4;L1300-07;h4;50;2;O08;5729;S1794;Fenofibrate;O09;2;O;9;USAN, INN, BAN, JAN;h5;L1300-05;36083;49562-28-9;NULL;72;199,5399496;<1;NA;http://www.selleckchem.com/products/Fenofibrate(Tricor).html;Fenofibrate (Tricor, Trilipix) is a compound of the fibrate class and fibric acid derivative.;Others;C20H21ClO4;Free Base;Antara, Fenoglide, Fibricor, Lipofen, Lofibra, Triglide;CC(C)OC(=O)C(C)(C)OC1=CC=C(C=C1)C(=O)C1=CC=C(Cl)C=C1 |c:12,14,24,t:10,19,21|;5,111;4;0;7;5;h;5;L1300-05;h5;50;2;O09;5730;S2125;Mestranol;O10;2;O;10;USAN, INN, BAN, JAN;h5;L1300-07;31043;72-33-3;NULL;15;48,32007216;<1;NA;http://www.selleckchem.com/products/Mestranol.html;Mestranol is the 3-methyl ether of ethinylestradiol. It was the estrogen used in many of the first oral contraceptives.;Others;C21H26O2;Free Base;N/A;[H][C@@]12CC[C@@](O)(C#C)[C@@]1(C)CC[C@]1([H])C3=C(CC[C@@]21[H])C=C(OC)C=C3 |r,c:15,27,t:23|;5,112;1;0;1;7;h;5;L1300-07;h5;50;2;O10;5731;S1811;Amiloride HCl;O11;2;O;11;USAN, INN, BAN;h6;L1300-05;26609;2016-88-8;Others;53;199,1807283;6;22,5487617;http://www.selleckchem.com/products/Amiloride-hydrochloride(Midamor).html;Amiloride hydrochloride(Midamor), a pyrazine compound inhibiting sodium reabsorption through sodium channels in renal epithelial cells.;Others;C6H9Cl2N7O;Hydrochloride;Midamor, Colectril, Amipramizide, Guanamprazine hydrochloride;Cl.NC(=N)NC(=O)C1=NC(Cl)=C(N)N=C1N |c:12,t:6,9|;-0,366;3;4;2;5;h;6;L1300-05;h6;50;2;O11;5732;S2152;Sitafloxacin Hydrate;O12;2;O;12;INN;h6;L1300-07;436.84;163253-35-8;Others;NA;10;NA;NA;http://www.selleckchem.com/products/Sitafloxacin(DU-6859A).html;Sitafloxacin Hydrate is a new-generation, broad-spectrum oral fluoroquinolone antibiotic.;Others;C19H18ClF2N3O3R;Free Base;DU 6859A, DU 6859, DU-6859, LS-184401;"[*].N[C@@H]1CN(CC11CC1)C1=C(Cl)C2=C(C=C1F)C(=O)C(=CN2[C@@H]1C[C@@H]1F)C(O)=O |r,$1.5H2O_R0;;;;;;;;;;;;;;;;;;;;;;;;;;;;$,c:10,13,15,21|";0,344;2;1;3;7;h;6;L1300-07;h6;50;2;O12;5733;S1830;Oxfendazole;O13;2;O;13;INN, BAN, CSP, Ph.Fr., USAN, USP;h7;L1300-05;31535;53716-50-0;Others;10;31,71079753;<1;NA;http://www.selleckchem.com/products/oxfendazole.html;Oxfendazole is the sulfoxide form of fenbendazole which is  a broad spectrum benzimidazole anthelmintic.;Others;C15H13N3O3S;Free Base;N/A;COC(=O)NC1=NC2=C(N1)C=C(C=C2)S(=O)C1=CC=CC=C1 |c:7,11,13,20,22,t:5,18|;2,657;4;2;4;5;h;7;L1300-05;h7;50;2;O13;5734;S2180;MLN2238;O14;2;O;14;INN, USAN;h7;L1300-07;36103;1072833-77-2;Proteasome;72;199,4294103;<1;NA;http://www.selleckchem.com/products/MLN-2238.html;MLN2238 inhibits the chymotrypsin-like proteolytic (_5) site of the 20S proteasome with IC50 and Ki of 3.4 nM and 0.93 nM, respectively, also inhibits the caspase-like (_1) and trypsin-like (_2) proteolytic sites, with IC50 of 31 and 3500 nM.;Proteases;C14H19BCl2N2O4;Free Base;N/A;CC(C)C[C@H](NC(=O)CNC(=O)C1=C(Cl)C=CC(Cl)=C1)B(O)O |r,c:12,15,18|;3,344;2;2;7;7;h;7;L1300-07;h7;50;2;O14;5735;S1840;Lomustine;O15;2;O;15;USP;h8;L1300-05;2337;13010-47-4;Others;46;196,8335473;<1;NA;http://www.selleckchem.com/products/Lomustine(CeeNU).html;Lomustine inhibits cancer cells by damaging the DNA and stops cells from dividing.;Others;C9H16ClN3O2;Free Base;CCNU;ClCCN(N=O)C(=O)NC1CCCCC1;2,394;2;1;4;5;h;8;L1300-05;h8;50;2;O15;5736;S2229;Eltrombopag Olamine;O16;2;O;16;INN;h8;L1300-07;56463;496775-62-3;Others;89;157,6253476;<1;NA;http://www.selleckchem.com/products/Eltrombopag-SB-497115-GR.html;Eltrombopag is a member of the biarylhydrazone class, which is a nonpeptide agonist of the thrombopoietin receptor (TpoR).;Others;C29H36N6O6;Free Base;SB-497115-GR, SB497115;NCCO.NCCO.CC1=NN(C(=O)C\1=N/NC1=CC=CC(C2=CC(=CC=C2)C(O)=O)=C1O)C1=CC=C(C)C(C)=C1 |c:18,23,25,30,40,t:7,16,21,34,36|;-0,151;4;6;7;7;h;8;L1300-07;h8;50;2;O16;5737;S1859;Diethylstilbestrol;O17;2;O;17;USP;h9;L1300-05;26835;56-53-1;Others;54;201,2297373;<1;NA;http://www.selleckchem.com/products/Diethylstilbestrol(Stilbestrol).html;Diethylstilbestrol, a synthetic nonsteroidal estrogen used in the treatment of menopausal and postmenopausal disorders.;Others;C18H20O2;Free Base;diethylstilboestrol, DES, Stilbestrol, Agostilben;CC\C(C1=CC=C(O)C=C1)=C(\CC)C1=CC=C(O)C=C1 |c:8,19,t:3,5,14,16|;5,137;0;2;4;5;h;9;L1300-05;h9;50;2;O17;5738;S2293;DL-Carnitine HCl;O18;2;O;18;INN;h9;L1300-07;19766;461-05-2;Others;40;202,3677021;40;202,3677021;http://www.selleckchem.com/products/DL-Carnitine-hydrochloride.html;DL-Carnitine hydrochloride is a quaternary ammonium compound biosynthesized from the amino acids lysine and methionine.;Others;C7H16ClNO3;Hydrochloride;N/A;[Cl-].C[N+](C)(C)CC(O)CC(O)=O;-4,49;1;1;4;7;h;9;L1300-07;h9;50;2;O18;5739;S1883;Idoxuridine;O19;2;O;19;USAN, INN;h10;L1300-05;3541;54-42-2;Others;35;98,84213499;<1;NA;http://www.selleckchem.com/products/idoxuridine.html;Idoxuridine is an antiviral agent for feline herpesvirus type-1 with IC50 of 4.3 µM.;Others;C9H11IN2O5;Free Base;N/A;OC[C@H]1O[C@H](C[C@@H]1O)N1C=C(I)C(=O)NC1=O |r,t:10|;-1,402;3;3;2;5;h;10;L1300-05;h10;50;2;O19;5740;S2393;Sorbitol;O20;2;O;20;USP;h10;L1300-07;18217;50-70-4;Others;36;197,6176099;36;197,6176099;http://www.selleckchem.com/products/Sorbitol(Glucitol).html;Sorbitol is a sugar alcohol and a sugar substitute.;Others;C6H14O6;Free Base;Glucitol;OC[C@H](O)[C@@H](O)[C@H](O)[C@H](O)CO |r|;-2,941;0;6;5;7;h;10;L1300-07;h10;50;2;O20;5741;S1896;Hydroxyurea;O21;2;O;21;USAN, INN, BAN;h11;L1300-05;7605;127-07-1;Others;15;197,2386588;15;197,2386588;http://www.selleckchem.com/products/Hydroxyurea(Cytodrox).html;Hydroxyurea is an antineoplastic agent that inhibits DNA synthesis through the inhibition of ribonucleoside diphosphate reductase.;Others;CH4N2O2;Free Base;Hydrea, Biosupressin;NC(=O)NO;-1,03;1;2;0;5;h;11;L1300-05;h11;50;2;O21;5742;S2456;Chlorpromazine HCl;O22;2;O;22;USAN, INN, BAN;h11;L1300-07;35533;69-09-0;Dopamine Receptor, Potassium Channel;71;199,8142572;71;199,8142572;http://www.selleckchem.com/products/Chlorpromazine-hydrochloride(Sonazine).html;Chlorpromazine HCl is a dopamine and potassium channel inhibitor with IC50 of 6.1 and 16 _M for nward-rectifying K+ currents and time-independent outward currents;Neuronal Signaling;C17H20Cl2N2S;Hydrochloride;Promacid;Cl.CN(C)CCCN1C2=C(SC3=C1C=C(Cl)C=C3)C=CC=C2 |c:7,10,16,19,21,t:13|;5,121;0;0;4;7;h;11;L1300-07;h11;50;2;O22;5743;S7279;Suvorexant (MK-4305);O23;2;O;23;FDA;h5;L1300-15;45092;1030377-33-3;OX Receptor;10;22,17688282;<1;NA;http://www.selleckchem.com/products/suvorexant-mk.html;Suvorexant (MK-4305) is a potent dual OX receptor antagonist with Ki of 0.55 nM and 0.35 nM for OX1 receptor and OX2 receptor, respectively. Phase 3.;GPCR & G Protein;C23H23ClN6O2;Free Base;N/A;C[C@@H]1CCN(CCN1C(=O)C1=CC(C)=CC=C1N1N=CC=N1)C1=NC2=CC(Cl)=CC=C2O1 |r,c:14,16,20,22,30,32,t:11,25,27|;4,108;5;0;3;5;h;12;L1300-15;h5;50;2;O23;5744;S7605;Filgotinib (GLPG0634);O24;2;O;24;INN;h7;L1300-15;4255;1206161-97-8;JAK;85;199,7649824;<1;NA;http://www.selleckchem.com/products/filgotinib.html;Filgotinib (GLPG0634) is a selective JAK1 inhibitor with IC50 of 10 nM, 28 nM, 810 nM, and 116 nM for JAK1, JAK2, JAK3, and TYK2, respectively. Phase 2.;JAK/STAT;C21H23N5O3S;Free Base;N/A;O=C(NC1=NN2C(C=CC=C2C2=CC=C(CN3CCS(=O)(=O)CC3)C=C2)=N1)C1CC1 |c:7,9,26,28,t:3,12,14|;2,461;5;1;5;7;h;12;L1300-15;h7;50;2;O24;5745;S1907;Metronidazole;P01;2;P;1;USAN, INN, BAN;h1;L1300-06;17115;443-48-1;Others;34;198,6561496;<1;NA;http://www.selleckchem.com/products/Metronidazole(Flagyl).html;Metronidazole(Flagyl)is a nitroimidazole antibiotic medication used particularly for anaerobic bacteria and protozoa.;Others;C6H9N3O3;Free Base;Nidagyl, Mepagyl, Anagiardil, Bayer 5360, NSC 50364, NSC69587;CC1=NC=C(N1CCO)[N+]([O-])=O |c:3,t:1|;-0,337;1;1;3;6;h;1;L1300-06;h1;50;2;P01;5746;NA;DMSO;P02;2;P;2;NA;NA;DMSO-source;NA;NA;NA;NA;NA;NA;NA;NA;NA;NA;NA;NA;NA;NA;NA;NA;NA;NA;NA;NA;NA;DMSO-source;1;50;2;P02;5747;S1917;Crystal Violet;P03;2;P;3;USP, JAN;h2;L1300-06;40798;548-62-9;Others;82;200,9902446;14;34,31540762;http://www.selleckchem.com/products/Crystal-violet.html;Crystal violet is a triarylmethane dye.;Others;C25H30ClN3;Chlorate;Gentian violet, Hexamethyl pararosaniline chloride;[Cl-].CN(C)C1=CC=C(C=C1)C(C1=CC=C(C=C1)N(C)C)=C1C=CC(C=C1)=[N+](C)C |c:5,7,13,15,22,25,t:3,11|;2,25;0;0;4;6;h;2;L1300-06;h2;50;2;P03;5748;S1626;Naproxen;P04;2;P;4;INN,BAN,BPC,ChP,DCF,DCIT,FEUM,JAN,JP ,Ph. Eur.,USAN,USP;h2;L1300-04;25224;26159-34-2;COX;3;11,89343482;50;198,2239137;http://www.selleckchem.com/products/Naproxen-Sodium(Aleve).html;Naproxen is a COX inhibitor for COX-1 and COX-2 with IC50 of 8.7 _M and 5.2 _M, respectively.;Neuronal Signaling;C14H13NaO3;Sodium;Anaprox, Naprelan;[Na+].COC1=CC=C2C=C(C=CC2=C1)[C@H](C)C([O-])=O |r,c:6,8,11,t:2,4|;1,375;1;0;3;4;h;2;L1300-04;h2;50;2;P04;5749;S1940;Levofloxacin;P05;2;P;5;INN, BAN, DCF, JAN, USAN;h3;L1300-06;36137;100986-85-4;Others;24;66,41392479;11;30,43971553;http://www.selleckchem.com/products/Levofloxacin(Levaquin).html;Levofloxacin is a synthetic fluoroquinolone (fluoroquinolones) antibacterial agent.;Others;C18H20FN3O4;Free Base;Levaquin, Tavanic;[H][C@]1(C)COC2=C(N3CCN(C)CC3)C(F)=CC3=C2N1C=C(C(O)=O)C3=O |r,c:5,16,18,t:23|;-1,374;3;0;2;6;h;3;L1300-06;h3;50;2;P05;5750;NA;DMSO;P06;2;P;6;NA;NA;DMSO-source;NA;NA;NA;NA;NA;NA;NA;NA;NA;NA;NA;NA;NA;NA;NA;NA;NA;NA;NA;NA;NA;DMSO-source;1;50;2;P06;5751;S1960;Pranoprofen;P07;2;P;7;INN, DCF, JAN;h4;L1300-06;25527;52549-17-4;Others;51;199,7884593;<1;NA;http://www.selleckchem.com/products/pranoprofen.html;Pranoprofen is a PGE2 inhibitor with IC50 of 7.5 _M.;Others;C15H13NO3;Free Base;N/A;CC(C(O)=O)C1=CC2=C(OC3=NC=CC=C3C2)C=C1 |c:12,14,19,t:5,7,10|;3,05;3;0;2;6;h;4;L1300-06;h4;50;2;P07;5752;S1645;Ketoprofen;P08;2;P;8;EMA;h4;L1300-04;25428;22071-15-4;COX;51;200,5663049;<1;NA;http://www.selleckchem.com/products/Ketoprofen(Actron).html;Ketoprofen (Actron) is a non-selective NSAID with IC50 of 0.5 _M and 2.33 _M for human recombinant COX-1 and COX-2, respectively.;Neuronal Signaling;C16H14O3;Free Base;Orudis, Oruvail;CC(C(O)=O)C1=CC(=CC=C1)C(=O)C1=CC=CC=C1 |c:7,9,16,18,t:5,14|;3,361;2;0;4;4;h;4;L1300-04;h4;50;2;P08;5753;S1975;Aripiprazole;P09;2;P;9;INN, BAN, JAN, USAN;h5;L1300-06;44839;129722-12-9;5-HT Receptor;90;200,7181248;<1;NA;http://www.selleckchem.com/products/aripiprazole-abilify.html;Aripiprazole is a human 5-HT1A receptor partial agonist with a Ki of 4.2 nM.;Neuronal Signaling;C23H27Cl2N3O2;Free Base;N/A;ClC1=CC=CC(N2CCN(CCCCOC3=CC=C4CCC(=O)NC4=C3)CC2)=C1Cl |c:3,25,30,t:1,15,17|;4,998;2;1;7;6;h;5;L1300-06;h5;50;2;P09;5754;NA;DMSO;P10;2;P;10;NA;NA;DMSO-source;NA;NA;NA;NA;NA;NA;NA;NA;NA;NA;NA;NA;NA;NA;NA;NA;NA;NA;NA;NA;NA;DMSO-source;1;50;2;P10;5755;S1994;Lacidipine;P11;2;P;11;INN, BAN, DCF, USAN;h6;L1300-06;45554;103890-78-4;Calcium Channel;91;199,7629187;<1;NA;http://www.selleckchem.com/products/lacidipine-lacipil-motens.html;Lacidipine (Lacipil, Motens) is a L-type calcium channel blocker.;Transmembrane Transporters;C26H33NO6;Free Base;Lacipil, Motens;CCOC(=O)C1=C(C)NC(C)=C(C1C1=C(\C=C\C(=O)OC(C)(C)C)C=CC=C1)C(=O)OCC |c:5,10,14,25,27|;3,824;6;1;11;6;h;6;L1300-06;h6;50;2;P11;5756;S1671;_6-__-_Aminocaproic acid;P12;2;P;12;INN,BAN, DCF, FEUM, IP, Ph.Eur., USAN, USP;h6;L1300-04;13117;60-32-2;Others;6;45,74216665;26;198,2160555;http://www.selleckchem.com/products/Aminocaproic-acid(Amicar).html;_6-__-_Aminocaproic acid is a derivative and analogue of the amino acid lysine.;Others;C6H13NO2;Free Base;Amicar, _-amino caproic acid, _-Ahx, 6-aminohexanoic acid;NCCCCCC(O)=O;-2,164;1;1;5;4;h;6;L1300-04;h6;50;2;P12;5757;S2017;Benidipine HCl;P13;2;P;13;INN;h7;L1300-06;54202;91599-74-5;calcium channel;8;14,75960297;<1;NA;http://www.selleckchem.com/products/benidipine-hydrochloride.html;Benidipine HCl is a hydrochloride salt form of benidipine which is a dihydropyridine calcium channel blocker.;Transmembrane Transporters;C28H32ClN3O6;Hydrochloride;N/A;Cl.COC(=O)C1=C(C)NC(C)=C([C@@H]1C1=CC(=CC=C1)[N+]([O-])=O)C(=O)O[C@@H]1CCCN(CC2=CC=CC=C2)C1 |r,c:4,9,15,17,34,36,t:13,32|;4,36;4;1;9;6;h;7;L1300-06;h7;50;2;P13;5758;NA;DMSO;P14;2;P;14;NA;NA;DMSO-source;NA;NA;NA;NA;NA;NA;NA;NA;NA;NA;NA;NA;NA;NA;NA;NA;NA;NA;NA;NA;NA;DMSO-source;1;50;2;P14;5759;S2031;Fenticonazole Nitrate;P15;2;P;15;(Fenticonazole), INN, BAN, DCF, Ph.Eur.;h8;L1300-06;51841;73151-29-8;Others;104;200,6134141;<1;NA;http://www.selleckchem.com/products/fenticonazole-nitrate.html;Fenticonazole nitrate is an azole antifungal agent.;Others;C24H21Cl2N3O4S;Nitrate;N/A;O[N+]([O-])=O.ClC1=CC=C(C(CN2C=CN=C2)OCC2=CC=C(SC3=CC=CC=C3)C=C2)C(Cl)=C1 |c:11,13,25,27,30,34,t:4,6,18,20,23|;5,176;2;0;8;6;h;8;L1300-06;h8;50;2;P15;5760;S1696;Hydrocortisone;P16;2;P;16;INN,BAN,BPC,ChP,CSP DCF,FEUM,IP,JAN,JP, Ph. Eur.,Ph. Hg.,Ph. Int.,RS,USP;h8;L1300-04;36246;50-23-7;Others;73;201,401534;<1;NA;http://www.selleckchem.com/products/Hydrocortisone.html;Hydrocortisone is a steroid hormone or glucocorticoid produced by the adrenal gland.;Others;C21H30O5;Free Base;Cortisol;[H][C@@]12CC[C@](O)(C(=O)CO)[C@@]1(C)C[C@H](O)[C@@]1([H])[C@@]2([H])CCC2=CC(=O)CC[C@]12C |r,t:23|;1,283;2;2;2;4;h;8;L1300-04;h8;50;2;P16;5761;S2042;Cyproterone Acetate;P17;2;P;17;Health Canada;h9;L1300-06;41694;427-51-0;Androgen Receptor/P450;83;199,0694105;<1;NA;http://www.selleckchem.com/products/cyproterone-acetate.html;Cyproterone acetate is an androgen receptor (AR) antagonist with IC50 of 7.1 nM, as well as a weak progesterone receptor agonist with weak pro-gestational and glucocorticoid activity.;Endocrinology & Hormones;C24H29ClO4;Acetate;N/A;[H][C@@]12CC[C@](OC(C)=O)(C(C)=O)[C@@]1(C)CC[C@@]1([H])[C@@]2([H])C=C(Cl)C2=CC(=O)[C@@H]3C[C@@H]3[C@]12C |r,t:22,25|;3,314;4;0;3;6;h;9;L1300-06;h9;50;2;P17;5762;NA;DMSO;P18;2;P;18;NA;NA;DMSO-source;NA;NA;NA;NA;NA;NA;NA;NA;NA;NA;NA;NA;NA;NA;NA;NA;NA;NA;NA;NA;NA;DMSO-source;1;50;2;P18;5763;S2054;Orphenadrine Citrate;P19;2;P;19;FDA;h10;L1300-06;4615;4682-36-4;AChR;92;199,3499458;<1;NA;http://www.selleckchem.com/products/orphenadrine-citrate-norflex.html;Orphenadrine citrate is a skeletal muscle relaxant, it acts in the central nervous system to produce its muscle relaxant effects.;Neuronal Signaling;C24H31NO8;Citrate;N/A;OC(=O)CC(O)(CC(O)=O)C(O)=O.CN(C)CCOC(C1=CC=CC=C1)C1=CC=CC=C1C |c:21,23,28,30,t:19,26|;-0,483;4;0;11;6;h;10;L1300-06;h10;50;2;P19;5764;S1717;Fomepizole;P20;2;P;20;USAN, INN, BAN;h10;L1300-04;82.1;7554-65-6;Dehydrogenase;The physical form of the compound is liquid, which can be dissolved in any proportion.;The physical form of the compound is liquid, which can be dissolved in any proportion.;The physical form of the compound is liquid, which can be dissolved in any proportion.;The physical form of the compound is liquid, which can be dissolved in any proportion.;http://selleckchem.com/products/Fomepizole(Antizol).html;Fomepizole is a competitive inhibitor of alcohol dehydrogenase, the enzyme that catalyzes the initial steps in the metabolism of ethylene glycol and methanol to their toxic metabolites.;Angiogenesis;C4H6N2;Free Base;4-methylpyrazole, Antizol, Antizol-Vet;CC1=CNN=C1 |c:4,t:1|;0,76;1;1;0;4;h;10;L1300-04;h10;50;2;P20;5765;S2064;Balofloxacin;P21;2;P;21;USP, INN, BAN, JAN;h11;L1300-06;38942;127294-70-6;Others;5;12,83960762;<1;NA;http://www.selleckchem.com/products/balofloxacin.html;Balofloxacin is quinolone antibiotic, inhibiting the synthesis of bacterial DNA by interference with the enqyme DNA gyrase.;Others;C20H24FN3O4;Free Base;N/A;CNC1CCCN(C1)C1=C(OC)C2=C(C=C1F)C(=O)C(=CN2C1CC1)C(O)=O |c:9,13,15,21|;-0,615;3;1;5;6;h;11;L1300-06;h11;50;2;P21;5766;NA;DMSO;P22;2;P;22;NA;NA;DMSO-source;NA;NA;NA;NA;NA;NA;NA;NA;NA;NA;NA;NA;NA;NA;NA;NA;NA;NA;NA;NA;NA;DMSO-source;1;50;2;P22;5767;S7397;Sorafenib;P23;2;P;23;FDA;h6;L1300-15;46482;284461-73-0;Raf;63;135,5363366;<1;NA;http://www.selleckchem.com/products/sorafenib.html;Sorafenib is a multikinase inhibitor of Raf-1, B-Raf and VEGFR-2 with IC50 of 6 nM, 22 nM and 90 nM, respectively.;MAPK;C21H16ClF3N4O3;Free Base;BAY 43-9006;CNC(=O)C1=CC(OC2=CC=C(NC(=O)NC3=CC=C(Cl)C(=C3)C(F)(F)F)C=C2)=CC=N1 |c:21,28,30,32,t:4,8,10,16,18|;4,175;4;3;6;6;h;12;L1300-15;h6;50;2;P23;5768;S7158;LY2835219;P24;2;P;24;INN;h4;L1300-15;6027;1231930-82-7;CDK;83;137,713622;100;165,9200265;http://www.selleckchem.com/products/ly2835219.html;LY2835219 is a potent and selective inhibitor of CDK4 and CDK6 with IC50 of 2 nM and 10 nM, respectively.;Cell Cycle;C28H36F2N8O3S;Mesylate;N/A;CS(O)(=O)=O.CCN1CCN(CC2=CC=C(NC3=NC(C4=CC(F)=C5N=C(C)N(C(C)C)C5=C4)=C(F)C=N3)N=C2)CC1 |c:32,37,40,t:11,13,16,19,22,24,34|;4,543;4;1;7;4;h;12;L1300-15;h4;50;2;P24;5769;S2457;Clindamycin HCl;A01;3;A;1;(Clindamycin),INN, BAN, BPC, BS, ChP, DCF, FEUM, JP, JRA, Ph.Eur., USAN, USP;a1;L1300-08;46144;21462-39-5;Others;92;199,3758669;92;199,3758669;http://www.selleckchem.com/products/Clindamycin-hydrochloride(Dalacin).html;Clindamycin hydrochloride(Dalacin) is the hydrated hydrochloride salt of clindamycin which is a semisynthetic antibiotic.;Others;C18H34Cl2N2O5S;Hydrochloride;Dalacin, Duac, BenzaClin,Clindoxyl, Acanya;Cl.CCC[C@@H]1C[C@H](N(C)C1)C(=O)N[C@H](C(C)Cl)[C@H]1O[C@H](SC)[C@H](O)[C@@H](O)[C@H]1O |r|;1,659;2;4;7;8;a;1;L1300-08;a1;50;3;A01;6770;S4040;Norethindrone;A02;3;A;2;FDA;a1;L1300-11;29842;68-22-4;Others;60;201,0589103;<1;NA;http://www.selleckchem.com/products/norethindrone-norethisterone.html;Norethindrone is a synthetic progestin, which mimic the actions of the endogenous ovarian hormone progesterone.;Others;C20H26O2;Free Base;N/A;[H][C@@]12CC[C@@](O)(C#C)[C@@]1(C)CC[C@]1([H])[C@@]3([H])CCC(=O)C=C3CC[C@@]21[H] |r,c:21|;4,315;1;0;0;11;a;1;L1300-11;a1;50;3;A02;6771;S2471;Gallamine Triethiodide;A03;3;A;3;INN, DCF, IP,Ph.Eur., Ph.Int., RS,USP;a2;L1300-08;89153;65-29-2;AChR;100;112,1667246;100;112,1667246;http://www.selleckchem.com/products/Gallamine-triethiodide(Flaxedil).html;Gallamine triethiodide(Flaxedil) is a cholinergic receptor blocker with an IC50 of 68.0 ± 8.4 _M.;Neuronal Signaling;C30H60I3N3O3;Lodine salt;Flaxedil;[I-].[I-].[I-].CC[N+](CC)(CC)CCOC1=CC=CC(OCC[N+](CC)(CC)CC)=C1OCC[N+](CC)(CC)CC |c:12,24,t:10|;-8,065;3;0;21;8;a;2;L1300-08;a2;50;3;A03;6772;NA;DMSO;A04;3;A;4;NA;NA;DMSO-source;NA;NA;NA;NA;NA;NA;NA;NA;NA;NA;NA;NA;NA;NA;NA;NA;NA;NA;NA;NA;NA;DMSO-source;1;50;3;A04;6773;S2485;Mitoxantrone HCl;A05;3;A;5;FDA;a3;L1300-08;5174;70476-82-3;Others;89;172,0139157;89;172,0139157;http://www.selleckchem.com/products/Mitoxantrone.html;Mitoxantrone HCl is a classic folic acid antagonist.;Others;C22H30Cl2N4O6;Hydrochloride;Novantrone;Cl.Cl.OCCNCCNC1=CC=C(NCCNCCO)C2=C1C(=O)C1=C(O)C=CC(O)=C1C2=O |c:18,23,26,29,t:7,9|;0,832;2;8;12;8;a;3;L1300-08;a3;50;3;A05;6774;S4058;Ropivacaine HCl;A06;3;A;6;USP, INN, BAN, JAN;a3;L1300-11;31086;98717-15-8;Others;62;199,4466963;46;147,9765811;http://www.selleckchem.com/products/ropivacaine-hcl.html;Ropivacaine HCl is an anaesthetic agent and blocks impulse conduction in nerve fibres through inhibiting sodium ion influx reversibly.;Others;C17H27ClN2O;HCl;N/A;Cl.CCCN1CCCC[C@H]1C(=O)NC1=C(C)C=CC=C1C |r,c:13,16,18|;4,236;1;1;4;11;a;3;L1300-11;a3;50;3;A06;6775;S2495;Oxymetazoline hydrochloride;A07;3;A;7;USP, INN, BAN;a4;L1300-08;29684;08.02.15;Adrenergic Receptor;59;198,7602749;59;198,7602749;http://www.selleckchem.com/products/Oxymetazoline-hydrochloride.html;Oxymetazoline hydrochloride is an _1 and _2 adrenergic receptor agonist.;Neuronal Signaling;C16H25ClN2O;Hydrochloride;N/A;Cl.CC1=CC(=C(O)C(C)=C1CC1=NCCN1)C(C)(C)C |c:7,t:1,3,11|;3,664;1;2;3;8;a;4;L1300-08;a4;50;3;A07;6776;NA;DMSO;A08;3;A;8;NA;NA;DMSO-source;NA;NA;NA;NA;NA;NA;NA;NA;NA;NA;NA;NA;NA;NA;NA;NA;NA;NA;NA;NA;NA;DMSO-source;1;50;3;A08;6777;S2506;Roxithromycin;A09;3;A;9;INN, BAN, DCF, JAN, USAN;a5;L1300-08;83706727;80214-83-1;Others;167;199,5060684;<1;NA;http://www.selleckchem.com/products/Roxithromycin(Roxl-150).html;Roxithromycin  is a semi-synthetic macrolide antibiotic. It is used to treat respiratory tract, urinary and soft tissue infections.;Others;C41H76N2O15;Free Base;Roxl-150, Roxo, Surlid, Rulide, Biaxsig, Roxar, Roximycin, Roxomycin, Tirabicin, Coroxin;CC[C@H]1OC(=O)[C@H](C)[C@@H](O[C@H]2C[C@@](C)(OC)[C@@H](O)[C@H](C)O2)[C@H](C)[C@@H](O[C@@H]2O[C@H](C)C[C@@H]([C@H]2O)N(C)C)[C@](C)(O)C[C@@H](C)\C(=N\OCOCCOC)[C@H](C)[C@@H](O)[C@]1(C)O |r|;1,619;11;3;13;8;a;5;L1300-08;a5;50;3;A09;6778;S4077;Mequinol;A10;3;A;10;INN, DCF, USAN;a5;L1300-11;12414;150-76-5;Others;25;201,3855325;25;201,3855325;http://www.selleckchem.com/products/mequinol.html;Mequinol (4-Methoxyphenol) is a depigmentation agent.;Others;C7H8O2;Free Base;N/A;COC1=CC=C(O)C=C1 |c:7,t:2,4|;1,571;1;1;1;11;a;5;L1300-11;a5;50;3;A10;6779;S2517;Maprotiline HCl;A11;3;A;11;FDA;a6;L1300-08;31386;10347-81-6;Reuptake inhibitor;63;200,7264385;<1;NA;http://www.selleckchem.com/products/Maprotiline-hydrochloride.html;Maprotiline hydrochloride (Deprilept, Ludiomil, Psymion) is a selective noradrenalin re-uptake inhibitor and a tetracyclic antidepressant.;Neuronal Signaling;C20H24ClN;Hydrochloride;Deprilept, Ludiomil, Psymion;Cl.CNCCCC12CCC(C3=CC=CC=C13)C1=C2C=CC=C1 |c:11,17,20,22,t:9,13|;4,498;0;1;4;8;a;6;L1300-08;a6;50;3;A11;6780;NA;DMSO;A12;3;A;12;NA;NA;DMSO-source;NA;NA;NA;NA;NA;NA;NA;NA;NA;NA;NA;NA;NA;NA;NA;NA;NA;NA;NA;NA;NA;DMSO-source;1;50;3;A12;6781;S2533;Ritodrine HCl;A13;3;A;13;USP, INN, BAN, JAN;a7;L1300-08;32381;23239-51-2;Adrenergic Receptor;65;200,7349989;65;200,7349989;www.selleckchem.com/products/Ritodrine-hydrochloride-Yutopar.html;"Ritodrine hydrochloride (DU 21220; Miolene; NSC 291565; Pre-Par) is a hydrochloride salt of ritodrine which is a _-2 adrenergic receptor agonist.";Neuronal Signaling;C17H22ClNO3;Hydrochloride;"DU 21220; Miolene; NSC 291565";Cl.[H][C@](C)(NCCC1=CC=C(O)C=C1)[C@@]([H])(O)C1=CC=C(O)C=C1 |r,c:11,22,t:6,8,17,19|;3,037;0;4;6;8;a;7;L1300-08;a7;50;3;A13;6782;S4098;Halcinonide;A14;3;A;14;USP, INN, BAN, JAN;a7;L1300-11;45496;3093-35-4;Others;90;197,8195885;<1;NA;http://www.selleckchem.com/products/halcinonide.html;Halcinonide is a high potency corticosteroid used in topical preparations as an anti-inflammatory agent.;Others;C24H32ClFO5;Free Base;N/A;[H][C@@]12C[C@H]3OC(C)(C)O[C@@]3(C(=O)CCl)[C@@]1(C)C[C@H](O)[C@@]1(F)[C@@]2([H])CCC2=CC(=O)CC[C@]12C |r,t:28|;2,384;4;1;2;11;a;7;L1300-11;a7;50;3;A14;6783;S2543;Ceftiofur HCl;A15;3;A;15;(Ceftiofur), INN, BAN, DCF;a8;L1300-08;560.02;103980-44-5;Others;112;199,9928574;<1;NA;http://www.selleckchem.com/products/Ceftiofur-hydrochloride.html;Ceftiofur HCl is a cephalosporin <b>antibiotic</b>, used to treat both Gram-positive and Gram-negative bacteria infection.;Others;C19H18ClN5O7S3;Hydrochloride;N/A;Cl.[H][C@@]1(NC(=O)C(=N\OC)\C2=CSC(N)=N2)C(=O)N2C(C(O)=O)=C(CSC(=O)C3=CC=CO3)CS[C@]12[H] |r,c:13,30,t:9,22,28|;1,09;8;2;9;8;a;8;L1300-08;a8;50;3;A15;6784;NA;DMSO;A16;3;A;16;NA;NA;DMSO-source;NA;NA;NA;NA;NA;NA;NA;NA;NA;NA;NA;NA;NA;NA;NA;NA;NA;NA;NA;NA;NA;DMSO-source;1;50;3;A16;6785;S2556;Rosiglitazone;A17;3;A;17;USP, INN, BAN, JAN;a9;L1300-08;35743;122320-73-4;PPAR;71;198,6402932;<1;NA;http://www.selleckchem.com/products/Rosiglitazone-Avandia.html;Rosiglitazone (Avandia) is a potent antihyperglycemic agent and a potent thiazolidinedione insulin sensitizer with IC50 of 12, 4 and 9 nM for rat, 3T3-L1 and human adipocytes, respectively.;DNA Damage;C18H19N3O3S;Free Base;Avandia, BRL-49653;CN(CCOC1=CC=C(CC2SC(=O)NC2=O)C=C1)C1=CC=CC=N1 |c:18,23,25,t:5,7,21|;3,268;4;1;7;8;a;9;L1300-08;a9;50;3;A17;6786;S4123;Timolol Maleate;A18;3;A;18;USP, JAN;a9;L1300-11;43249;26921-17-5;Adrenergic Receptor;86;198,8485283;<1;NA;https://www.selleckchem.com/products/timolol-maleate.html;Timolol Maleate is a non-selective, beta-adrenergic receptor antagonist for _1/_2 with Ki of 1.97 nM/2.0 nM.;Neuronal Signaling;C17H28N4O7S;Maleate;N/A;OC(=O)\C=C/C(O)=O.CC(C)(C)NC[C@H](O)COC1=NSN=C1N1CCOCC1 |r,c:20,t:17|;-1,539;6;2;9;11;a;9;L1300-11;a9;50;3;A18;6787;S2567;Medroxyprogesterone acetate;A19;3;A;19;FDA;a10;L1300-08;38652;71-58-9;Estrogen/progestogen Receptor;12;31,04625893;<1;NA;http://www.selleckchem.com/products/Medroxyprogesterone-acetate.html;Medroxyprogesterone acetate is a progestin, a synthetic variant of the human hormone progesterone and a potent progesterone receptor agonist.;Endocrinology & Hormones;C24H34O4;Free Base;Medroxyprogesterone 17-acetate, MPA;[H][C@@]12CC[C@](OC(C)=O)(C(C)=O)[C@@]1(C)CC[C@@]1([H])[C@@]2([H])C[C@H](C)C2=CC(=O)CC[C@]12C |r,t:25|;3,755;4;0;3;8;a;10;L1300-08;a10;50;3;A19;6788;NA;DMSO;A20;3;A;20;NA;NA;DMSO-source;NA;NA;NA;NA;NA;NA;NA;NA;NA;NA;NA;NA;NA;NA;NA;NA;NA;NA;NA;NA;NA;DMSO-source;1;50;3;A20;6789;S2581;Quinapril HCl;A21;3;A;21;USP, INN, BAN;a11;L1300-08;47498;82586-55-8;RAAS;18;37,89633248;95;200,0084214;http://www.selleckchem.com/products/quinapril-hydrochloride-accupril.html;Quinapril hydrochloride (Accupril) is the hydrochloride salt of quinapril that is an angiotensin-converting enzyme inhibitor with a Ki of 20 _M.;Endocrinology & Hormones;C25H31ClN2O5;Hydrochloride;N/A;Cl.CCOC(=O)[C@H](CCC1=CC=CC=C1)N[C@@H](C)C(=O)N1CC2=C(C[C@H]1C(O)=O)C=CC=C2 |r,c:10,12,22,30,32,t:8|;1,038;4;1;10;8;a;11;L1300-08;a11;50;3;A21;6790;S4155;Chlorzoxazone;A22;3;A;22;FDA;a11;L1300-11;16957;95-25-0;Others;34;200,5071652;<1;NA;http://www.selleckchem.com/products/chlorzoxazone.html;Chlorzoxazone is a muscle-relaxing drug,and a probe for human liver cytochrome P-450IIE1.;Others;C7H4ClNO2;Free Base;N/A;ClC1=CC2=C(OC(=O)N2)C=C1 |c:10,t:1,3|;2,004;2;1;0;11;a;11;L1300-11;a11;50;3;A22;6